{"$id":"https://anki-study-report.local/schemas/review-xp-candidate-protocol-v1.schema.json","$schema":"https://json-schema.org/draft/2020-12/schema","additionalProperties":false,"properties":{"$schema":{"const":"../schemas/review-xp-candidate-protocol-v1.schema.json"},"allowed_final_outcomes":{"const":["RECOMMEND_RESEARCH_CANDIDATE","REJECT_REVIEW_MODEL","DEFER_REVIEW_MODEL"]},"amendment_policy":{"additionalProperties":false,"properties":{"decision_semantics_must_remain_unchanged":{"const":true},"substantive_amendment_requires":{"items":{"type":"string"},"minItems":7,"type":"array"},"typo_or_link_correction_may_keep_version":{"const":true}},"required":["substantive_amendment_requires","typo_or_link_correction_may_keep_version","decision_semantics_must_remain_unchanged"],"type":"object"},"candidate_families":{"items":{"additionalProperties":false,"properties":{"abuse_risks":{"items":{"type":"string"},"minItems":1,"type":"array"},"candidate_id":{"pattern":"^F-[A-Z0-9-]+$","type":"string"},"causal_claim":{"minLength":1,"type":"string"},"classification":{"const":"RESEARCH_ONLY_PROSPECTIVE_HYPOTHESIS"},"expected_direction":{"type":"string"},"fairness_risks":{"items":{"type":"string"},"minItems":1,"type":"array"},"hypothesis_id":{"pattern":"^H-[A-Z0-9-]+$","type":"string"},"known_uncertainties":{"items":{"type":"string"},"minItems":1,"type":"array"},"mechanism_class":{"minLength":1,"type":"string"},"mutation_surface":{"items":{"type":"string"},"minItems":1,"type":"array"},"source_evidence_refs":{"items":{"pattern":"^SRC-[A-Z0-9-]+$","type":"string"},"minItems":1,"type":"array","uniqueItems":true},"unchanged_surfaces":{"items":{"type":"string"},"minItems":1,"type":"array"}},"required":["candidate_id","hypothesis_id","mechanism_class","causal_claim","source_evidence_refs","expected_direction","mutation_surface","unchanged_surfaces","known_uncertainties","fairness_risks","abuse_risks","classification"],"type":"object"},"maxItems":3,"minItems":1,"type":"array"},"confirmatory_boundary":{"additionalProperties":false,"properties":{"future_stage":{"const":"G1.5"},"identity_independent_thresholds_frozen":{"const":true},"post_result_threshold_selection_forbidden":{"const":true},"required_package":{"items":{"type":"string"},"minItems":1,"type":"array","uniqueItems":true},"survivor_relative_threshold_rule":{"type":"string"}},"required":["future_stage","required_package","identity_independent_thresholds_frozen","survivor_relative_threshold_rule","post_result_threshold_selection_forbidden"],"type":"object"},"falsification_conditions":{"items":{"additionalProperties":false,"properties":{"aggregation":{"minLength":1,"type":"string"},"comparison_value":{"oneOf":[{"type":"number"},{"type":"boolean"},{"type":"string"}]},"failure_consequence":{"minLength":1,"type":"string"},"inclusive_semantics":{"minLength":1,"type":"string"},"metric_id":{"pattern":"^[a-z0-9_]+$","type":"string"},"metric_type":{"enum":["number","integer","boolean","status"]},"missing_data_behavior":{"enum":["FAIL_CLOSED","BLOCK"]},"operator":{"enum":["<","<=","==",">=",">","!="]},"predicate_id":{"pattern":"^[A-Z0-9-]+$","type":"string"},"predicate_kind":{"enum":["HARD_GATE","INVARIANT","TECHNICAL_GATE","BOUNDARY_GATE","FALSIFICATION","STOP_CONDITION"]},"rationale":{"minLength":1,"type":"string"},"required_cases":{"items":{"pattern":"^CASE-[A-Z0-9-]+$","type":"string"},"minItems":1,"type":"array","uniqueItems":true},"required_replicas":{"const":[0,1]},"rounding_policy":{"const":"NO_ROUNDING_BINARY64_COMPARE_WITH_FROZEN_TOLERANCE"},"scope":{"type":"object"},"score_compensation_allowed":{"const":false},"severity":{"enum":["HARD","BLOCKING"]},"threshold_source":{"minLength":1,"type":"string"},"unit":{"enum":["ratio","review_units","count","boolean","status"]}},"required":["predicate_id","predicate_kind","metric_id","metric_type","scope","required_cases","required_replicas","aggregation","operator","comparison_value","unit","inclusive_semantics","rounding_policy","missing_data_behavior","severity","failure_consequence","threshold_source","rationale","score_compensation_allowed"],"type":"object"},"minItems":1,"type":"array"},"hard_gates":{"items":{"additionalProperties":false,"properties":{"aggregation":{"minLength":1,"type":"string"},"comparison_value":{"oneOf":[{"type":"number"},{"type":"boolean"},{"type":"string"}]},"failure_consequence":{"minLength":1,"type":"string"},"inclusive_semantics":{"minLength":1,"type":"string"},"metric_id":{"pattern":"^[a-z0-9_]+$","type":"string"},"metric_type":{"enum":["number","integer","boolean","status"]},"missing_data_behavior":{"enum":["FAIL_CLOSED","BLOCK"]},"operator":{"enum":["<","<=","==",">=",">","!="]},"predicate_id":{"pattern":"^[A-Z0-9-]+$","type":"string"},"predicate_kind":{"enum":["HARD_GATE","INVARIANT","TECHNICAL_GATE","BOUNDARY_GATE","FALSIFICATION","STOP_CONDITION"]},"rationale":{"minLength":1,"type":"string"},"required_cases":{"items":{"pattern":"^CASE-[A-Z0-9-]+$","type":"string"},"minItems":1,"type":"array","uniqueItems":true},"required_replicas":{"const":[0,1]},"rounding_policy":{"const":"NO_ROUNDING_BINARY64_COMPARE_WITH_FROZEN_TOLERANCE"},"scope":{"type":"object"},"score_compensation_allowed":{"const":false},"severity":{"enum":["HARD","BLOCKING"]},"threshold_source":{"minLength":1,"type":"string"},"unit":{"enum":["ratio","review_units","count","boolean","status"]}},"required":["predicate_id","predicate_kind","metric_id","metric_type","scope","required_cases","required_replicas","aggregation","operator","comparison_value","unit","inclusive_semantics","rounding_policy","missing_data_behavior","severity","failure_consequence","threshold_source","rationale","score_compensation_allowed"],"type":"object"},"minItems":1,"type":"array"},"identity":{"additionalProperties":false,"properties":{"protocol_id":{"const":"review-xp-candidate-protocol"},"protocol_status":{"const":"FROZEN_PRE_SCREENING"},"protocol_version":{"const":1}},"required":["protocol_id","protocol_version","protocol_status"],"type":"object"},"metrics":{"items":{"additionalProperties":false,"properties":{"definition":{"minLength":1,"type":"string"},"finite_required":{"type":"boolean"},"metric_id":{"pattern":"^[a-z0-9_]+$","type":"string"},"metric_type":{"enum":["number","integer","boolean","status"]},"unit":{"enum":["ratio","review_units","count","boolean","status"]}},"required":["metric_id","metric_type","unit","definition"],"type":"object"},"minItems":1,"type":"array"},"parameter_bounds":{"items":{"additionalProperties":false,"properties":{"adaptive":{"const":false},"current_baseline_value_or_scale":{"type":"number"},"derivation_rule":{"minLength":1,"type":"string"},"maximum":{"type":"number"},"maximum_inclusive":{"type":"boolean"},"minimum":{"type":"number"},"minimum_inclusive":{"type":"boolean"},"parameter_id":{"pattern":"^[a-z0-9_]+$","type":"string"},"reason_interval_is_bounded":{"minLength":1,"type":"string"},"scientific_rationale":{"minLength":1,"type":"string"},"source_locations":{"items":{"type":"string"},"minItems":1,"type":"array"},"source_refs":{"items":{"pattern":"^SRC-[A-Z0-9-]+$","type":"string"},"minItems":1,"type":"array"},"unit":{"enum":["ratio","day_index","days"]}},"required":["parameter_id","unit","current_baseline_value_or_scale","minimum","maximum","minimum_inclusive","maximum_inclusive","source_refs","source_locations","derivation_rule","scientific_rationale","reason_interval_is_bounded","adaptive"],"type":"object"},"minItems":1,"type":"array"},"parameterizations":{"items":{"additionalProperties":false,"properties":{"bound_refs":{"items":{"type":"string"},"minItems":1,"type":"array","uniqueItems":true},"candidate_id":{"pattern":"^F-[A-Z0-9-]+$","type":"string"},"construction_rule":{"minLength":1,"type":"string"},"expected_effect":{"type":"string"},"falsification_refs":{"items":{"pattern":"^FALSIFY-[A-Z0-9-]+$","type":"string"},"minItems":1,"type":"array"},"parameter_values":{"additionalProperties":{"type":"number"},"minProperties":1,"type":"object"},"parameterization_id":{"pattern":"^P-[A-Z0-9-]+$","type":"string"}},"required":["parameterization_id","candidate_id","parameter_values","construction_rule","bound_refs","expected_effect","falsification_refs"],"type":"object"},"maxItems":6,"minItems":1,"type":"array"},"production_boundary":{"additionalProperties":false,"properties":{"dashboard_or_api_changed":{"const":false},"package_or_release_changed":{"const":false},"production_approved":{"const":false},"production_integration":{"const":"PROHIBITED"},"reward_formula_changed_in_g1_3":{"const":false},"scheduler_semantics_changed":{"const":false}},"required":["production_approved","production_integration","reward_formula_changed_in_g1_3","scheduler_semantics_changed","dashboard_or_api_changed","package_or_release_changed"],"type":"object"},"promotion_rules":{"items":{"additionalProperties":false,"properties":{"all_required_replicas":{"const":true},"failure_consequence":{"type":"string"},"family_survivor_limit":{"const":1},"least_bad_promotion_forbidden":{"const":true},"one_replica_only_forbidden":{"const":true},"post_hoc_threshold_change_forbidden":{"const":true},"predicate_kind":{"const":"PROMOTION_RULE"},"promotion_rule_id":{"type":"string"},"required_hard_gate_ids":{"items":{"type":"string"},"minItems":1,"type":"array","uniqueItems":true}},"required":["promotion_rule_id","predicate_kind","required_hard_gate_ids","family_survivor_limit","all_required_replicas","one_replica_only_forbidden","post_hoc_threshold_change_forbidden","least_bad_promotion_forbidden","failure_consequence"],"type":"object"},"minItems":1,"type":"array"},"protected_invariants":{"items":{"additionalProperties":false,"properties":{"automation_status":{"enum":["EXECUTABLE_CURRENT","REQUIRES_G14_IMPLEMENTATION","REPOSITORY_POLICY"]},"confirmatory_predicate":{"type":"string"},"failure_consequence":{"type":"string"},"invariant_id":{"pattern":"^INV-[A-Z0-9-]+$","type":"string"},"screening_predicate":{"type":"string"},"source_refs":{"items":{"pattern":"^SRC-[A-Z0-9-]+$","type":"string"},"minItems":1,"type":"array"}},"required":["invariant_id","source_refs","automation_status","screening_predicate","confirmatory_predicate","failure_consequence"],"type":"object"},"minItems":16,"type":"array"},"provenance":{"additionalProperties":false,"properties":{"baseline_commit":{"pattern":"^[0-9a-f]{40}$","type":"string"},"baseline_divergence":{"additionalProperties":false,"properties":{"details":{"type":"string"},"diverged":{"type":"boolean"}},"required":["diverged","details"],"type":"object"},"baseline_observed_at":{"pattern":"^2026-07-21$","type":"string"},"expected_baseline_commit":{"pattern":"^[0-9a-f]{40}$","type":"string"},"frozen_source_blobs":{"items":{"additionalProperties":false,"properties":{"blob_sha":{"pattern":"^[0-9a-f]{40}$","type":"string"},"path":{"pattern":"^(?!/)(?![A-Za-z]:)(?!.*(?:^|/)\\.\\.(?:/|$))(?!.*\\\\)(?![A-Za-z][A-Za-z0-9+.-]*:)(?!.*[\\x00-\\x1F\\x7F])[A-Za-z0-9._/-]+$","type":"string"},"protocol_relevance":{"minLength":1,"type":"string"},"role":{"minLength":1,"type":"string"}},"required":["path","blob_sha","role","protocol_relevance"],"type":"object"},"minItems":1,"type":"array","uniqueItems":true}},"required":["expected_baseline_commit","baseline_commit","baseline_observed_at","baseline_divergence","frozen_source_blobs"],"type":"object"},"readiness":{"additionalProperties":false,"properties":{"candidate_selected":{"const":false},"execution_blockers":{"items":{"type":"string"},"minItems":1,"type":"array"},"g1_3_status":{"const":"COMPLETE"},"g1_4_execution_readiness":{"enum":["READY","BLOCKED_ON_IMPLEMENTATION"]},"g1_4_protocol_readiness":{"const":"READY"},"g1_4_started":{"const":false}},"required":["g1_3_status","g1_4_protocol_readiness","g1_4_execution_readiness","execution_blockers","g1_4_started","candidate_selected"],"type":"object"},"reference_candidate":{"additionalProperties":false,"properties":{"candidate_id":{"const":"R-CURRENT"},"classification":{"const":"REFERENCE_REGRESSION_CONTROL"},"parameterization_id":{"const":"R-CURRENT"},"survivor_eligible":{"const":false}},"required":["candidate_id","classification","parameterization_id","survivor_eligible"],"type":"object"},"scientific_boundary":{"additionalProperties":false,"properties":{"candidate_selected":{"const":false},"challenge_direction_consistent":{"const":false},"classification":{"const":"ROOT_CAUSE_PARTIALLY_LOCALIZED"},"confidence":{"const":"MEDIUM"},"dominant_component":{"const":"memory_main"},"dominant_component_share":{"const":0.4552230855238075},"dominant_window":{"const":"post_transition"},"dominant_window_share":{"const":0.8565121323195105},"evidence_class":{"const":"SYNTHETIC_POST_HOC_ATTRIBUTION"},"human_learning_effectiveness_claimed":{"const":false},"real_user_reward_gaming_claimed":{"const":false}},"required":["evidence_class","classification","confidence","dominant_component","dominant_component_share","dominant_window","dominant_window_share","challenge_direction_consistent","candidate_selected","human_learning_effectiveness_claimed","real_user_reward_gaming_claimed"],"type":"object"},"screening_budget":{"additionalProperties":false,"properties":{"adaptive_extra_units_allowed":{"const":false},"computed_max_units":{"const":160},"dimension_sizes":{"const":{"candidate_or_reference":5,"control_condition":1,"horizon":2,"policy_pair":4,"population_variant":1,"replica":2,"seed":2}},"estimated_runtime_class":{"const":"BOUNDED_MEDIUM"},"failure_on_budget_exceed":{"const":"ABORT_G1_4_AND_INVALIDATE_SCREENING"},"inclusion_formula":{"const":"5 * 4 * 1 * 2 * 2 * 2 * 1"},"unit_definition":{"type":"string"}},"required":["unit_definition","dimension_sizes","inclusion_formula","computed_max_units","estimated_runtime_class","adaptive_extra_units_allowed","failure_on_budget_exceed"],"type":"object"},"screening_cases":{"items":{"additionalProperties":false,"properties":{"case_id":{"pattern":"^CASE-[A-Z0-9-]+$","type":"string"},"control_condition":{"type":"string"},"policy_pair":{"items":{"type":"string"},"maxItems":2,"minItems":2,"type":"array"},"purpose":{"type":"string"}},"required":["case_id","policy_pair","control_condition","purpose"],"type":"object"},"maxItems":4,"minItems":4,"type":"array"},"screening_dimensions":{"additionalProperties":false,"properties":{"candidate_or_reference":{"items":{"type":"string"},"minItems":2,"type":"array","uniqueItems":true},"control_conditions":{"const":["MATCHED_CONTROL_FROM_CASE"]},"horizons":{"const":[90,365]},"policy_pairs":{"const":["CASE-RETENTION-HIGH","CASE-RETENTION-LOW","CASE-INTENTIONAL-BACKLOG","CASE-HONEST-BACKLOG-RETURN"]},"population_unit":{"additionalProperties":false,"properties":{"cards_by_horizon":{"const":{"365":20,"90":24}},"personas_used":{"const":false},"unit":{"const":"synthetic_cards_per_replica"}},"required":["unit","cards_by_horizon","personas_used"],"type":"object"},"population_variants":{"const":["CANONICAL_SYNTHETIC_COHORT"]},"replicas":{"const":[0,1]},"required_invariant_checks":{"items":{"type":"string"},"minItems":1,"type":"array","uniqueItems":true},"seeds":{"const":[20260716,20260717]}},"required":["candidate_or_reference","policy_pairs","control_conditions","horizons","replicas","seeds","population_variants","population_unit","required_invariant_checks"],"type":"object"},"stop_conditions":{"items":{"additionalProperties":false,"properties":{"aggregation":{"minLength":1,"type":"string"},"comparison_value":{"oneOf":[{"type":"number"},{"type":"boolean"},{"type":"string"}]},"failure_consequence":{"minLength":1,"type":"string"},"inclusive_semantics":{"minLength":1,"type":"string"},"metric_id":{"pattern":"^[a-z0-9_]+$","type":"string"},"metric_type":{"enum":["number","integer","boolean","status"]},"missing_data_behavior":{"enum":["FAIL_CLOSED","BLOCK"]},"operator":{"enum":["<","<=","==",">=",">","!="]},"predicate_id":{"pattern":"^[A-Z0-9-]+$","type":"string"},"predicate_kind":{"enum":["HARD_GATE","INVARIANT","TECHNICAL_GATE","BOUNDARY_GATE","FALSIFICATION","STOP_CONDITION"]},"rationale":{"minLength":1,"type":"string"},"required_cases":{"items":{"pattern":"^CASE-[A-Z0-9-]+$","type":"string"},"minItems":1,"type":"array","uniqueItems":true},"required_replicas":{"const":[0,1]},"rounding_policy":{"const":"NO_ROUNDING_BINARY64_COMPARE_WITH_FROZEN_TOLERANCE"},"scope":{"type":"object"},"score_compensation_allowed":{"const":false},"severity":{"enum":["HARD","BLOCKING"]},"threshold_source":{"minLength":1,"type":"string"},"unit":{"enum":["ratio","review_units","count","boolean","status"]}},"required":["predicate_id","predicate_kind","metric_id","metric_type","scope","required_cases","required_replicas","aggregation","operator","comparison_value","unit","inclusive_semantics","rounding_policy","missing_data_behavior","severity","failure_consequence","threshold_source","rationale","score_compensation_allowed"],"type":"object"},"minItems":1,"type":"array"}},"required":["$schema","identity","provenance","scientific_boundary","reference_candidate","candidate_families","parameter_bounds","parameterizations","screening_dimensions","screening_cases","screening_budget","metrics","hard_gates","promotion_rules","falsification_conditions","protected_invariants","confirmatory_boundary","stop_conditions","allowed_final_outcomes","amendment_policy","readiness","production_boundary"],"type":"object"}
