{"$schema":"../schemas/review-xp-candidate-protocol-v1.schema.json","allowed_final_outcomes":["RECOMMEND_RESEARCH_CANDIDATE","REJECT_REVIEW_MODEL","DEFER_REVIEW_MODEL"],"amendment_policy":{"decision_semantics_must_remain_unchanged":true,"substantive_amendment_requires":["new protocol version","rationale","field-level diff","results-viewed disclosure","prior-evidence impact","rerun matrix","roadmap decision"],"typo_or_link_correction_may_keep_version":true},"candidate_families":[{"abuse_risks":["A timing-aware rule could create session-boundary or delay incentives if applied outside the frozen transition state"],"candidate_id":"F-POST-TRANSITION-MG-STEP","causal_claim":"The dominant post-transition MemoryGain contribution drives the systematic 90-to-365 retention-cycling growth; scaling only that contribution after the final retention transition should remove growth without changing baseline reward or pre-transition behavior.","classification":"RESEARCH_ONLY_PROSPECTIVE_HYPOTHESIS","expected_direction":"LOWER_POST_TRANSITION_MEMORY_GAIN_REDUCES_RETENTION_CYCLING_DELTA","fairness_risks":["A broad reduction could lower honest return-from-backlog reward"],"hypothesis_id":"H-MEMORY-POST-STEP","known_uncertainties":["Attribution is synthetic and post-hoc","MemoryGain is dominant but not uniquely causal","Challenge sign is not direction-consistent","Two replicas do not estimate a population distribution"],"mechanism_class":"POST_TRANSITION_MEMORY_GAIN_STEP_SCALING","mutation_surface":["memory_gain_credit contribution after day 60 for cycling policies"],"source_evidence_refs":["SRC-G12A-EVIDENCE","SRC-EPISODE-REWARD","SRC-PARAMETERS","SRC-PARAMETER-CATALOG","SRC-LONGITUDINAL-CONFIG"],"unchanged_surfaces":["AttemptCredit","OutcomeCredit","Challenge calculation","scheduler and FSRS state","button semantics","day-level support/volume/completion","pre-transition MemoryGain","production runtime"]},{"abuse_risks":["Transition timing must be derived from policy state, never user session boundaries"],"candidate_id":"F-POST-TRANSITION-MG-TAPER","causal_claim":"If an abrupt step is unnecessarily destructive, a fixed 30-day taper beginning at the final day-60 transition should reduce the dominant post-transition MemoryGain contribution while preserving more near-transition honest reward.","classification":"RESEARCH_ONLY_PROSPECTIVE_HYPOTHESIS","expected_direction":"LOWER_LATE_POST_TRANSITION_MEMORY_GAIN_REDUCES_RETENTION_CYCLING_DELTA_WITH_NO_ADDITIONAL_BACKLOG_PENALTY","fairness_risks":["Taper may still reduce contextual reward for honest backlog return"],"hypothesis_id":"H-MEMORY-POST-TAPER","known_uncertainties":["Linear taper shape is a prospective mechanism, not an observed causal law","Attribution does not prove the optimal taper shape","Current runner has no window-conditioned reward hook"],"mechanism_class":"POST_TRANSITION_MEMORY_GAIN_LINEAR_TAPER","mutation_surface":["memory_gain_credit contribution from day 60 through day 90 and thereafter for cycling policies"],"source_evidence_refs":["SRC-G12A-EVIDENCE","SRC-EPISODE-REWARD","SRC-PARAMETERS","SRC-LONGITUDINAL-CONFIG"],"unchanged_surfaces":["AttemptCredit","OutcomeCredit","Challenge calculation","scheduler and FSRS state","button semantics","day-level support/volume/completion","pre-transition MemoryGain","production runtime"]}],"confirmatory_boundary":{"future_stage":"G1.5","identity_independent_thresholds_frozen":true,"post_result_threshold_selection_forbidden":true,"required_package":["matched 90/365 evidence","same-seed replay","secondary-seed behavior","parameter sensitivity","population/persona sensitivity","backlog fairness","session invariance","direct-button neutrality","suppression and abuse checks","strict schema/evidence validation","complete gate table","source/environment/artifact provenance","comparison with R-CURRENT","all amendment disclosures"],"survivor_relative_threshold_rule":"Resolve only from R-CURRENT matched values and the exact operators/tolerances frozen in this protocol before viewing G1.5 results."},"falsification_conditions":[{"aggregation":"ANY_REQUIRED_CELL","comparison_value":1e-09,"failure_consequence":"FALSIFY_FAMILY","inclusive_semantics":"EXCLUSIVE","metric_id":"delta_365_minus_90","metric_type":"number","missing_data_behavior":"FAIL_CLOSED","operator":">","predicate_id":"FALSIFY-STEP-NO-EFFECT","predicate_kind":"FALSIFICATION","rationale":"Any retained positive growth falsifies the step hypothesis for that parameterization.","required_cases":["CASE-RETENTION-HIGH","CASE-RETENTION-LOW"],"required_replicas":[0,1],"rounding_policy":"NO_ROUNDING_BINARY64_COMPARE_WITH_FROZEN_TOLERANCE","scope":{"family":"F-POST-TRANSITION-MG-STEP"},"score_compensation_allowed":false,"severity":"HARD","threshold_source":"G1.1 growth tolerance","unit":"ratio"},{"aggregation":"ANY_REQUIRED_CELL","comparison_value":-1e-09,"failure_consequence":"FALSIFY_PARAMETERIZATION","inclusive_semantics":"EXCLUSIVE","metric_id":"honest_backlog_differential_vs_reference","metric_type":"number","missing_data_behavior":"FAIL_CLOSED","operator":"<","predicate_id":"FALSIFY-STEP-FAIRNESS","predicate_kind":"FALSIFICATION","rationale":"A new honest-return penalty falsifies acceptable step scaling.","required_cases":["CASE-HONEST-BACKLOG-RETURN"],"required_replicas":[0,1],"rounding_policy":"NO_ROUNDING_BINARY64_COMPARE_WITH_FROZEN_TOLERANCE","scope":{"family":"F-POST-TRANSITION-MG-STEP"},"score_compensation_allowed":false,"severity":"HARD","threshold_source":"G1.1 baseline tolerance","unit":"review_units"},{"aggregation":"ANY_REQUIRED_CELL","comparison_value":1e-09,"failure_consequence":"FALSIFY_FAMILY","inclusive_semantics":"EXCLUSIVE","metric_id":"delta_365_minus_90","metric_type":"number","missing_data_behavior":"FAIL_CLOSED","operator":">","predicate_id":"FALSIFY-TAPER-NO-EFFECT","predicate_kind":"FALSIFICATION","rationale":"Any retained positive growth falsifies the taper hypothesis for that parameterization.","required_cases":["CASE-RETENTION-HIGH","CASE-RETENTION-LOW"],"required_replicas":[0,1],"rounding_policy":"NO_ROUNDING_BINARY64_COMPARE_WITH_FROZEN_TOLERANCE","scope":{"family":"F-POST-TRANSITION-MG-TAPER"},"score_compensation_allowed":false,"severity":"HARD","threshold_source":"G1.1 growth tolerance","unit":"ratio"},{"aggregation":"ANY_REQUIRED_CELL","comparison_value":-1e-09,"failure_consequence":"FALSIFY_PARAMETERIZATION","inclusive_semantics":"EXCLUSIVE","metric_id":"honest_backlog_differential_vs_reference","metric_type":"number","missing_data_behavior":"FAIL_CLOSED","operator":"<","predicate_id":"FALSIFY-TAPER-FAIRNESS","predicate_kind":"FALSIFICATION","rationale":"A new honest-return penalty falsifies acceptable tapering.","required_cases":["CASE-HONEST-BACKLOG-RETURN"],"required_replicas":[0,1],"rounding_policy":"NO_ROUNDING_BINARY64_COMPARE_WITH_FROZEN_TOLERANCE","scope":{"family":"F-POST-TRANSITION-MG-TAPER"},"score_compensation_allowed":false,"severity":"HARD","threshold_source":"G1.1 baseline tolerance","unit":"review_units"},{"aggregation":"REQUIRED_REPLICAS_AND_SEEDS","comparison_value":false,"failure_consequence":"FALSIFY_PARAMETERIZATION","inclusive_semantics":"EXACT","metric_id":"evidence_complete","metric_type":"boolean","missing_data_behavior":"FAIL_CLOSED","operator":"==","predicate_id":"FALSIFY-ONE-REPLICA-ONLY","predicate_kind":"FALSIFICATION","rationale":"An effect supported by only one replica is not promotable.","required_cases":["CASE-RETENTION-HIGH","CASE-RETENTION-LOW"],"required_replicas":[0,1],"rounding_policy":"NO_ROUNDING_BINARY64_COMPARE_WITH_FROZEN_TOLERANCE","scope":{"families":"ALL"},"score_compensation_allowed":false,"severity":"HARD","threshold_source":"G1.3 prospective rule","unit":"boolean"},{"aggregation":"GLOBAL","comparison_value":"UNREGISTERED_PARAMETERIZATION_USED","failure_consequence":"FALSIFY_SCREENING","inclusive_semantics":"EXACT","metric_id":"research_only_classification","metric_type":"status","missing_data_behavior":"FAIL_CLOSED","operator":"==","predicate_id":"FALSIFY-POSTHOC-PARAMETER","predicate_kind":"FALSIFICATION","rationale":"Unregistered values invalidate screening.","required_cases":["CASE-RETENTION-HIGH","CASE-RETENTION-LOW","CASE-INTENTIONAL-BACKLOG","CASE-HONEST-BACKLOG-RETURN"],"required_replicas":[0,1],"rounding_policy":"NO_ROUNDING_BINARY64_COMPARE_WITH_FROZEN_TOLERANCE","scope":{"families":"ALL"},"score_compensation_allowed":false,"severity":"HARD","threshold_source":"G1.3 frozen registry","unit":"status"}],"hard_gates":[{"aggregation":"EACH_CASE_SEED_REPLICA","comparison_value":0.03,"failure_consequence":"ELIMINATE_PARAMETERIZATION","inclusive_semantics":"INCLUSIVE_WITH_ABS_TOLERANCE_1E-9","metric_id":"unexplained_advantage","metric_type":"number","missing_data_behavior":"FAIL_CLOSED","operator":"<=","predicate_id":"GATE-ENDPOINT-CAP","predicate_kind":"HARD_GATE","rationale":"Each 365-day retention cell must remain under the existing one-sided cap.","required_cases":["CASE-RETENTION-HIGH","CASE-RETENTION-LOW"],"required_replicas":[0,1],"rounding_policy":"NO_ROUNDING_BINARY64_COMPARE_WITH_FROZEN_TOLERANCE","scope":{"horizons":[365],"variants":"ALL"},"score_compensation_allowed":false,"severity":"HARD","threshold_source":"G1.1 frozen endpoint cap","unit":"ratio"},{"aggregation":"EACH_CASE_SEED_REPLICA","comparison_value":1e-09,"failure_consequence":"ELIMINATE_PARAMETERIZATION","inclusive_semantics":"INCLUSIVE","metric_id":"delta_365_minus_90","metric_type":"number","missing_data_behavior":"FAIL_CLOSED","operator":"<=","predicate_id":"GATE-NO-CYCLING-GROWTH","predicate_kind":"HARD_GATE","rationale":"Promotion requires no matched replica to retain positive cross-horizon growth.","required_cases":["CASE-RETENTION-HIGH","CASE-RETENTION-LOW"],"required_replicas":[0,1],"rounding_policy":"NO_ROUNDING_BINARY64_COMPARE_WITH_FROZEN_TOLERANCE","scope":{"horizons":[90,365],"variants":"ALL"},"score_compensation_allowed":false,"severity":"HARD","threshold_source":"G1.1 replica growth tolerance","unit":"ratio"},{"